{
  "schema":"exchange.api_probe.profile.v1","venue":"mexc","display_name":"MEXC","provenance":"built_in",
  "products":[
    {"id":"spot","default_symbol":"BTCUSDT","symbol_format":"{base}{quote}","channels":[
      {"id":"trades_protobuf","kind":"trade","support":"adapter_required","transport":"ws","wire":"protobuf","host":"wbs-api.mexc.com","port":443,"path":"/ws","subscribe":"{\"method\":\"SUBSCRIPTION\",\"params\":[\"spot@public.aggre.deals.v3.api.pb@10ms@{symbol}\"],\"id\":0}","subscribe_binary":false,"compression":"none","adapter":"adapters/mexc_protobuf","capabilities":["live_trades"]},
      {"id":"orderbook_protobuf","kind":"depth","support":"adapter_required","transport":"ws","wire":"protobuf","host":"wbs-api.mexc.com","port":443,"path":"/ws","subscribe":"{\"method\":\"SUBSCRIPTION\",\"params\":[\"spot@public.aggre.depth.v3.api.pb@10ms@{symbol}\"],\"id\":0}","subscribe_binary":false,"compression":"none","adapter":"adapters/mexc_protobuf","depth_semantics":"stream_snapshot_delta","capabilities":["live_l2"]}
    ],"discovery":[]},
    {"id":"futures","default_symbol":"BTC_USDT","symbol_format":"{base}_{quote}","channels":[
      {"id":"trades","kind":"trade","support":"observed_only","transport":"ws","wire":"json","host":"contract.mexc.com","port":443,"path":"/edge","subscribe":"{\"method\":\"sub.deal\",\"param\":{\"symbol\":\"{symbol}\"},\"gzip\":false}","compression":"none","capabilities":["live_trades"]},
      {"id":"orderbook","kind":"depth","support":"observed_only","transport":"ws","wire":"json","host":"contract.mexc.com","port":443,"path":"/edge","subscribe":"{\"method\":\"sub.depth\",\"param\":{\"symbol\":\"{symbol}\"},\"gzip\":false}","compression":"none","depth_semantics":"stream_snapshot_delta","capabilities":["live_l2"]}
    ],"discovery":[]}
  ]
}
