{
  "schema":"exchange.api_probe.profile.v1","venue":"xt","display_name":"XT","provenance":"built_in",
  "products":[
    {"id":"spot","default_symbol":"btc_usdt","symbol_format":"{base}_{quote}:lower","channels":[
      {"id":"trades","kind":"trade","support":"observed_only","transport":"ws","wire":"json","host":"stream.xt.com","port":443,"path":"/public","subscribe":"{\"method\":\"subscribe\",\"params\":[\"trade@{symbol}\"],\"id\":\"1\"}","compression":"none","capabilities":["live_trades"]},
      {"id":"orderbook","kind":"depth","support":"observed_only","transport":"ws","wire":"json","host":"stream.xt.com","port":443,"path":"/public","subscribe":"{\"method\":\"subscribe\",\"params\":[\"depth_update@{symbol}\"],\"id\":\"1\"}","compression":"none","depth_semantics":"stream_snapshot_delta","capabilities":["live_l2"]}
    ],"discovery":[]},
    {"id":"futures","default_symbol":"btc_usdt","symbol_format":"{base}_{quote}:lower","channels":[
      {"id":"trades","kind":"trade","support":"observed_only","transport":"ws","wire":"json","host":"fstream.xt.com","port":443,"path":"/ws/market","subscribe":"{\"method\":\"SUBSCRIBE\",\"params\":[\"trade@{symbol}\"],\"id\":\"1\"}","compression":"none","capabilities":["live_trades"]},
      {"id":"orderbook","kind":"depth","support":"observed_only","transport":"ws","wire":"json","host":"fstream.xt.com","port":443,"path":"/ws/market","subscribe":"{\"method\":\"SUBSCRIBE\",\"params\":[\"depth_update@{symbol},100ms\"],\"id\":\"1\"}","compression":"none","depth_semantics":"stream_snapshot_delta","capabilities":["live_l2"]}
    ],"discovery":[]}
  ]
}
